STATION CODE,LOCATIONS,STATE,TEMPERATURE in degree Centigrade] - Mean,D.O. (mg/l) [> 4 mg/l] - Mean,pH [6.5-8.5] - Mean,CONDUCTIVITY (µmhos/cm)] - Mean,B.O.D. (mg/l) [< 3 mg/l] - Mean,Safe?,lat,lng,Unsafe Parameters
1232.0,MAHI D/S CONF WITH R. CHAP (UNDER SAGWARA-SARHI RD. BDG.),RAJASTHAN,26.71,5.24,8.03,556.67,1.47,Unsafe,,,['DO']
2932.0,"NARMADA MAIN CANAL (BEFORE ENTERING IN RAJASTHAN STATE), TEHSIL SANCHORE, JALORE",RAJASTHAN,22.21,6.91,8.08,377.5,1.19,Safe,,,['NONE']
2933.0,"GANG CANAL AT KHAKKA HEAR NEAR HINDUMAL KOT, GANGANAGAR",RAJASTHAN,24.66,5.84,7.27,333.33,1.3,Unsafe,,,['DO']
2934.0,MASITAWALA HEAD HANUMANGARH,RAJASTHAN,28.47,5.92,7.08,324.17,1.33,Unsafe,,,['DO']
1718.0,GAGGAR RIVER WHEN ENTERING IN RAJASTHAN FROM HARYANA NEAR RD NO. 629,RAJASTHAN,32.7,4.75,7.48,280.0,2.42,Unsafe,,,"['DO', 'BOD']"
2947.0,"JAWAI AT JAWAI DAM, SIROHI",RAJASTHAN,23.92,6.04,8.28,468.33,1.41,Safe,,,['NONE']
1717.0,"KODRA DAM, MOUNT ABU",RAJASTHAN,19.42,5.95,7.29,234.17,1.5,Unsafe,,,['DO']
2948.0,"BANDI AT HEMAWAS DAM, PAL",RAJASTHAN,23.43,6.39,8.04,527.14,1.19,Safe,,,['NONE']
2949.0,"RIVER LUNI AT RANAKPUR DAM, RANAKPUR, PALI",RAJASTHAN,23.58,5.85,7.91,795.83,1.47,Unsafe,,,['DO']
1285.0,PICHOLA LAKE AT UDAIPUR (WATER INTAKE POINT),RAJASTHAN,23.92,5.21,7.93,645.0,1.4,Unsafe,,,['DO']
1286.0,UDAISAGAR LAKE AT UDAIPUR (INTAKE PT.),RAJASTHAN,23.83,4.98,8.31,1667.5,3.33,Unsafe,,,"['EC', 'DO', 'BOD']"
1414.0,PUSHKAR LAKE,RAJASTHAN,18.92,3.94,7.61,455.5,4.77,Unsafe,,,"['DO', 'BOD']"
1481.0,FATEH SAGAR LAKE AT UDAIPUR INTAKE POINT OF PHED,RAJASTHAN,23.67,5.42,8.41,634.17,1.5,Unsafe,,,['DO']
1714.0,KAYALANA JHEEL JODHPUR,RAJASTHAN,22.13,6.62,8.11,337.5,1.5,Safe,,,['NONE']
1716.0,"NAKKI LAKE, MT. ABU",RAJASTHAN,19.33,5.68,8.03,316.67,2.22,Unsafe,,,"['DO', 'BOD']"
2935.0,"LAKE JET SAGAR, BUNDI",RAJASTHAN,25.33,4.86,7.57,521.67,1.81,Unsafe,,,['DO']
2936.0,"JAISAMAND LAKE, ALWAR",RAJASTHAN,25.6,5.11,8.02,326.0,1.78,Unsafe,,,['DO']
2941.0,"LAKE JAISAMAND, SALUMBER, UDAIPUR, POINT NO. 1",RAJASTHAN,22.67,6.43,8.35,621.67,1.39,Safe,,,['NONE']
2942.0,"LAKE JAISAMAND, SALUMBER, UDAIPUR, POINT NO. 2",RAJASTHAN,23.08,6.34,8.35,616.67,1.49,Safe,,,['NONE']
2937.0,"LAKE SILISERH, ALWAR",RAJASTHAN,25.29,5.06,7.91,362.5,1.35,Unsafe,,,['DO']
2938.0,"LAKE RAJSAMAND, RAJSAMAND- POINT NO. 1, RAJSAMAND",RAJASTHAN,20.03,5.8,8.33,610.0,2.52,Unsafe,,,"['DO', 'BOD']"
2939.0,"LAKE RAJSAMAND, RAJSAMAND- POINT NO. 2, RAJSAMAND",RAJASTHAN,20.17,5.88,7.94,596.67,2.4,Unsafe,,,"['DO', 'BOD']"
2940.0,"GAPE- SAGAR LAKE, DUNGARPUR",RAJASTHAN,22.58,4.82,7.95,600.0,1.71,Unsafe,,,['DO']
2943.0,"LODHA TALAB, BANSWARA- DUNGARPUR ROAD, BANSWARA",RAJASTHAN,26.79,4.43,7.65,916.5,2.25,Unsafe,,,"['DO', 'BOD']"
2944.0,"JALMAHAL, JAIPUR",RAJASTHAN,25.54,3.8,8.53,2255.0,7.03,Unsafe,,,"['pH', 'EC', 'DO', 'BOD']"
2955.0,"CHAMBAL ENTERING IN RAJASTHAN AT GANDHI SAGAR DAM, KOTA",RAJASTHAN,25.67,5.95,7.76,435.0,1.28,Unsafe,,,['DO']
1288.0,CHAMBAL AT KOTA U/S (INTAKE PT. NEAR BARRAGE),RAJASTHAN,27.88,6.18,7.71,391.67,1.07,Safe,,,['NONE']
1289.0,CHAMBAL AT KOTA D/S (2 KM. FROM CITY),RAJASTHAN,25.98,5.22,7.99,595.0,2.26,Unsafe,,,"['DO', 'BOD']"
1413.0,CHAMBAL AT RAMESHWARGHAT NR. SAWAIMADHOPUR,RAJASTHAN,23.25,5.86,7.47,589.17,1.68,Unsafe,,,['DO']
2954.0,"PARVATI BEFORE MEETING RIVER CHAMBAL AT KHATOLI, KOTA",RAJASTHAN,25.47,5.18,7.98,534.17,2.62,Unsafe,,,"['DO', 'BOD']"
2953.0,"KALI SINDH AT ANICUT OF M/S CFCL GADEPAN, KOTA",RAJASTHAN,24.54,5.11,7.75,514.17,3.41,Unsafe,,,"['DO', 'BOD']"
2956.0,"KALI SINDH AT BAROD ROAD BRIDGE, KOTA",RAJASTHAN,24.76,5.42,7.89,572.5,2.12,Unsafe,,,"['DO', 'BOD']"
2950.0,"BANAS AT DHANARI DAM, NEAR SWAROOPGANJ, SIROHI",RAJASTHAN,21.83,5.45,7.81,537.5,2.57,Unsafe,,,"['DO', 'BOD']"
2951.0,"BANAS AT BISULPUR DAM, TONK",RAJASTHAN,20.17,5.9,8.0,397.5,1.53,Unsafe,,,['DO']
2952.0,"BANAS AT NEAR NEWTA DAM, JAIPUR",RAJASTHAN,24.92,2.71,7.9,1630.83,17.22,Unsafe,,,"['EC', 'DO', 'BOD']"
2945.0,"CHHAPI AT UPSTREAM OF CHHAPI DAM, JHALAWAR",RAJASTHAN,26.93,5.71,7.98,444.17,1.86,Unsafe,,,['DO']
2946.0,"UJAD AT UPSTREAM OF BHIM SAGAR DAM, JHALAWAR",RAJASTHAN,27.07,5.16,8.13,375.0,1.72,Unsafe,,,['DO']
